{
  "$schema": "https://json-schema.org/draft/2020-12/schema",
  "additionalProperties": false,
  "properties": {
    "color_space": {},
    "has_alpha": {},
    "height": {},
    "id": {"pattern": "^[a-z0-9]+(?:-[a-z0-9]+)*$", "type": "string"},
    "kind": {"const": "candidate-asset"},
    "media_type": {},
    "path": {},
    "provenance": {},
    "quality_stage": {
      "enum": ["transport_smoke_output", "technical_candidate"],
      "type": "string"
    },
    "request_ref": {},
    "schema_version": {"const": "1.0"},
    "sha256": {},
    "status": {},
    "width": {}
  },
  "required": [
    "kind", "schema_version", "id", "request_ref", "path", "sha256",
    "width", "height", "color_space", "has_alpha", "media_type", "status",
    "provenance"
  ],
  "title": "candidate-asset",
  "type": "object"
}
