{
  "color_space": "sRGB",
  "has_alpha": true,
  "height": 2048,
  "id": "candidate-demo",
  "kind": "candidate-asset",
  "media_type": "image/png",
  "path": "tests/fixtures/synthetic/candidate-demo.png",
  "provenance": {"source": "synthetic-fixture"},
  "request_ref": "request-demo",
  "schema_version": "1.0",
  "sha256": "aaaaaaaaaaaaaaaaaaaaaaaaaaaaaaaaaaaaaaaaaaaaaaaaaaaaaaaaaaaaaaaa",
  "status": "received",
  "width": 2048
}
